{
  "$schema": "https://json-schema.org/draft/2020-12/schema",
  "title": "Astra verification development v1",
  "type": "object",
  "additionalProperties": false,
  "properties": {
    "schema_version": {
      "const": 1
    },
    "project": {
      "type": "string",
      "pattern": "^[a-zA-Z][a-zA-Z0-9_-]{0,95}$"
    },
    "rules": {
      "type": "string",
      "minLength": 1,
      "maxLength": 4096
    },
    "standard": {
      "type": "string",
      "minLength": 1,
      "maxLength": 4096
    },
    "design": {
      "type": "string",
      "minLength": 1,
      "maxLength": 4096
    },
    "inputs": {
      "type": "array",
      "items": {
        "type": "string",
        "minLength": 1,
        "maxLength": 4096
      },
      "minItems": 1,
      "maxItems": 4096,
      "uniqueItems": true
    },
    "platforms": {
      "type": "array",
      "items": {
        "type": "object",
        "additionalProperties": false,
        "properties": {
          "id": {
            "type": "string",
            "pattern": "^[a-zA-Z][a-zA-Z0-9_-]{0,95}$"
          },
          "system": {
            "enum": [
              "Linux",
              "Windows",
              "Darwin"
            ]
          },
          "machine": {
            "type": "string",
            "minLength": 1,
            "maxLength": 4096
          }
        },
        "required": [
          "id",
          "system",
          "machine"
        ]
      },
      "minItems": 1,
      "maxItems": 4096
    },
    "components": {
      "type": "array",
      "items": {
        "type": "object",
        "additionalProperties": false,
        "properties": {
          "id": {
            "type": "string",
            "pattern": "^[a-zA-Z][a-zA-Z0-9_-]{0,95}$"
          },
          "role": {
            "enum": [
              "storage-core",
              "component"
            ]
          },
          "paths": {
            "type": "array",
            "items": {
              "type": "string",
              "minLength": 1,
              "maxLength": 4096
            },
            "minItems": 1,
            "maxItems": 4096,
            "uniqueItems": true
          },
          "level": {
            "enum": [
              "L1",
              "L2",
              "L3"
            ]
          },
          "evidence_trust": {
            "enum": [
              "local",
              "ci",
              "release"
            ]
          },
          "platforms": {
            "type": "array",
            "items": {
              "type": "string",
              "pattern": "^[a-zA-Z][a-zA-Z0-9_-]{0,95}$"
            },
            "minItems": 1,
            "maxItems": 4096,
            "uniqueItems": true
          },
          "contracts": {
            "type": "array",
            "items": {
              "type": "object",
              "additionalProperties": false,
              "properties": {
                "id": {
                  "type": "string",
                  "pattern": "^[a-zA-Z][a-zA-Z0-9_-]{0,95}$"
                },
                "statement": {
                  "type": "string",
                  "minLength": 1,
                  "maxLength": 4096
                }
              },
              "required": [
                "id",
                "statement"
              ]
            },
            "minItems": 1,
            "maxItems": 4096
          },
          "applicability": {
            "type": "object",
            "minProperties": 1,
            "maxProperties": 256,
            "additionalProperties": {
              "type": "object",
              "additionalProperties": false,
              "properties": {
                "status": {
                  "enum": [
                    "applicable",
                    "not-applicable"
                  ]
                },
                "reason": {
                  "type": "string",
                  "minLength": 1,
                  "maxLength": 4096
                },
                "fact": {
                  "type": "string",
                  "minLength": 1,
                  "maxLength": 4096
                }
              },
              "required": [
                "status",
                "reason",
                "fact"
              ]
            }
          },
          "requirements": {
            "type": "array",
            "items": {
              "type": "object",
              "additionalProperties": false,
              "properties": {
                "rule": {
                  "type": "string",
                  "pattern": "^[a-zA-Z][a-zA-Z0-9_-]{0,95}$"
                },
                "contract": {
                  "type": "string",
                  "pattern": "^[a-zA-Z][a-zA-Z0-9_-]{0,95}$"
                },
                "scenario": {
                  "type": "string",
                  "pattern": "^[a-zA-Z][a-zA-Z0-9_-]{0,95}$"
                },
                "checks": {
                  "type": "array",
                  "items": {
                    "type": "string",
                    "pattern": "^[a-zA-Z][a-zA-Z0-9_-]{0,95}$"
                  },
                  "minItems": 1,
                  "maxItems": 4096,
                  "uniqueItems": true
                }
              },
              "required": [
                "rule",
                "contract",
                "scenario",
                "checks"
              ]
            },
            "minItems": 1,
            "maxItems": 4096
          },
          "convergence": {
            "type": "object",
            "additionalProperties": false,
            "properties": {
              "metric": {
                "type": "string",
                "minLength": 1,
                "maxLength": 4096
              },
              "baseline": {
                "anyOf": [
                  {
                    "type": "integer",
                    "minimum": 0,
                    "maximum": 9007199254740991
                  },
                  {
                    "type": "null"
                  }
                ]
              },
              "target": {
                "const": 0
              },
              "deadline": {
                "anyOf": [
                  {
                    "type": "string",
                    "pattern": "^\\d{4}-\\d{2}-\\d{2}T\\d{2}:\\d{2}:\\d{2}(\\.\\d{1,6})?Z$"
                  },
                  {
                    "type": "null"
                  }
                ]
              },
              "approval_ref": {
                "anyOf": [
                  {
                    "type": "string",
                    "minLength": 1,
                    "maxLength": 4096
                  },
                  {
                    "type": "null"
                  }
                ]
              }
            },
            "required": [
              "metric",
              "baseline",
              "target",
              "deadline",
              "approval_ref"
            ]
          }
        },
        "required": [
          "id",
          "role",
          "paths",
          "level",
          "evidence_trust",
          "platforms",
          "contracts",
          "applicability",
          "requirements",
          "convergence"
        ]
      },
      "minItems": 1,
      "maxItems": 4096
    },
    "checks": {
      "type": "array",
      "items": {
        "oneOf": [
          {
            "type": "object",
            "additionalProperties": false,
            "properties": {
              "id": {
                "type": "string",
                "pattern": "^[a-zA-Z][a-zA-Z0-9_-]{0,95}$"
              },
              "component": {
                "type": "string",
                "pattern": "^[a-zA-Z][a-zA-Z0-9_-]{0,95}$"
              },
              "adapter": {
                "const": "unavailable"
              },
              "reason": {
                "type": "string",
                "minLength": 1,
                "maxLength": 4096
              }
            },
            "required": [
              "id",
              "component",
              "adapter",
              "reason"
            ]
          },
          {
            "type": "object",
            "additionalProperties": false,
            "properties": {
              "id": {
                "type": "string",
                "pattern": "^[a-zA-Z][a-zA-Z0-9_-]{0,95}$"
              },
              "component": {
                "type": "string",
                "pattern": "^[a-zA-Z][a-zA-Z0-9_-]{0,95}$"
              },
              "adapter": {
                "const": "go-test-json"
              },
              "argv": {
                "type": "array",
                "items": {
                  "type": "string",
                  "minLength": 1,
                  "maxLength": 4096
                },
                "minItems": 1,
                "maxItems": 64
              },
              "environment": {
                "type": "object",
                "maxProperties": 32,
                "propertyNames": {
                  "pattern": "^[A-Z][A-Z0-9_]*$"
                },
                "additionalProperties": {
                  "type": "string",
                  "minLength": 1,
                  "maxLength": 4096
                }
              },
              "package": {
                "type": "string",
                "minLength": 1,
                "maxLength": 4096
              },
              "expected_tests": {
                "type": "array",
                "items": {
                  "type": "string",
                  "minLength": 1,
                  "maxLength": 4096
                },
                "minItems": 1,
                "maxItems": 4096,
                "uniqueItems": true
              },
              "probes": {
                "type": "array",
                "items": {
                  "type": "object",
                  "additionalProperties": false,
                  "properties": {
                    "contract": {
                      "type": "string",
                      "pattern": "^[a-zA-Z][a-zA-Z0-9_-]{0,95}$"
                    },
                    "test": {
                      "type": "string",
                      "minLength": 1,
                      "maxLength": 4096
                    },
                    "minimum_hits": {
                      "type": "integer",
                      "minimum": 1,
                      "maximum": 2147483647
                    }
                  },
                  "required": [
                    "contract",
                    "test",
                    "minimum_hits"
                  ]
                },
                "minItems": 1,
                "maxItems": 4096
              },
              "timeout_s": {
                "type": "integer",
                "minimum": 1,
                "maximum": 3600
              },
              "log_bytes": {
                "type": "integer",
                "minimum": 1024,
                "maximum": 67108864
              }
            },
            "required": [
              "id",
              "component",
              "adapter",
              "argv",
              "environment",
              "package",
              "expected_tests",
              "probes",
              "timeout_s",
              "log_bytes"
            ]
          }
        ]
      },
      "minItems": 1,
      "maxItems": 4096
    }
  },
  "required": [
    "schema_version",
    "project",
    "rules",
    "standard",
    "design",
    "inputs",
    "platforms",
    "components",
    "checks"
  ]
}
