{
  "schema_version": 1,
  "project": "astra",
  "rules": "tools/rules.json",
  "standard": "docs/development.md",
  "design": "docs/features/verification.md",
  "inputs": [
    "go.mod",
    "go.sum",
    "tools/verify.py",
    "tools/schemas",
    "tests/test_verify.py",
    "polaris/internal/storage"
  ],
  "platforms": [
    {
      "id": "linux-amd64-cgo",
      "system": "Linux",
      "machine": "x86_64"
    }
  ],
  "components": [
    {
      "id": "polaris-storage",
      "role": "storage-core",
      "paths": [
        "polaris/internal/storage"
      ],
      "level": "L3",
      "evidence_trust": "ci",
      "platforms": [
        "linux-amd64-cgo"
      ],
      "contracts": [
        {
          "id": "STORAGE-ATOMIC",
          "statement": "同一 scope 一版本多键提交后, 快照与回放保留整个批次; 此检查只证明受控串行样例, 并发交错另列缺口."
        },
        {
          "id": "STORAGE-RETRY",
          "statement": "同版本同内容重试不增加历史; 同版本异内容拒绝且状态不变."
        },
        {
          "id": "STORAGE-ROLLBACK",
          "statement": "第二条 SQL 插入失败后, 第一条更新、版本和历史都回滚; 解除故障后可提交."
        },
        {
          "id": "STORAGE-HISTORY",
          "statement": "有界历史拒绝落后游标, 保留连续后缀; 正常关闭重开保持数据与版本, 不代替断电耐久."
        },
        {
          "id": "STORAGE-ASSURANCE",
          "statement": "组件完整维护准入: 规范全部适用规则及 L3 覆盖、独立模型、故障、变异和交付矩阵. 首次接入不据已有测试反推完整性."
        }
      ],
      "applicability": {
        "DEV-SCOPE": {
          "status": "applicable",
          "reason": "采用范围、权限与适用性",
          "fact": "Polaris 持久状态核心; 此次为完整维护义务登记, 仅本地样例采集不替代整条规则."
        },
        "DEV-TRACE": {
          "status": "applicable",
          "reason": "功能设计准入、需求到证据、公共示例",
          "fact": "Polaris 持久状态核心; 此次为完整维护义务登记, 仅本地样例采集不替代整条规则."
        },
        "DEV-CORE": {
          "status": "applicable",
          "reason": "可测边界与执行载体",
          "fact": "Polaris 持久状态核心; 此次为完整维护义务登记, 仅本地样例采集不替代整条规则."
        },
        "DEV-ASYNC": {
          "status": "applicable",
          "reason": "任务归属、取消与排干",
          "fact": "Polaris 持久状态核心; 此次为完整维护义务登记, 仅本地样例采集不替代整条规则."
        },
        "DEV-TIME": {
          "status": "applicable",
          "reason": "时间域、虚拟时间与租约",
          "fact": "Polaris 持久状态核心; 此次为完整维护义务登记, 仅本地样例采集不替代整条规则."
        },
        "DEV-CONTRACT": {
          "status": "applicable",
          "reason": "行为、失败保证与提交边界",
          "fact": "Polaris 持久状态核心; 此次为完整维护义务登记, 仅本地样例采集不替代整条规则."
        },
        "DEV-SECURITY": {
          "status": "applicable",
          "reason": "信任、秘密、输入与故障隔离",
          "fact": "Polaris 持久状态核心; 此次为完整维护义务登记, 仅本地样例采集不替代整条规则."
        },
        "DEV-CAPACITY": {
          "status": "applicable",
          "reason": "聚合预算与过载",
          "fact": "Polaris 持久状态核心; 此次为完整维护义务登记, 仅本地样例采集不替代整条规则."
        },
        "DEV-RETRY": {
          "status": "applicable",
          "reason": "幂等、结果未知与重试控制",
          "fact": "Polaris 持久状态核心; 此次为完整维护义务登记, 仅本地样例采集不替代整条规则."
        },
        "DEV-ORACLE": {
          "status": "applicable",
          "reason": "独立判定、有效性与防弱化",
          "fact": "Polaris 持久状态核心; 此次为完整维护义务登记, 仅本地样例采集不替代整条规则."
        },
        "DEV-REDGREEN": {
          "status": "applicable",
          "reason": "旧失败、新通过及调度证据",
          "fact": "Polaris 持久状态核心; 此次为完整维护义务登记, 仅本地样例采集不替代整条规则."
        },
        "DEV-COVERAGE": {
          "status": "applicable",
          "reason": "覆盖分母、变异与排除",
          "fact": "Polaris 持久状态核心; 此次为完整维护义务登记, 仅本地样例采集不替代整条规则."
        },
        "DEV-REPLAY": {
          "status": "applicable",
          "reason": "确定性输入、重放与语料",
          "fact": "Polaris 持久状态核心; 此次为完整维护义务登记, 仅本地样例采集不替代整条规则."
        },
        "DEV-NUMERIC": {
          "status": "applicable",
          "reason": "数值语义与跨平台条件",
          "fact": "Polaris 持久状态核心; 此次为完整维护义务登记, 仅本地样例采集不替代整条规则."
        },
        "DEV-FAULT": {
          "status": "applicable",
          "reason": "故障边界与恢复",
          "fact": "Polaris 持久状态核心; 此次为完整维护义务登记, 仅本地样例采集不替代整条规则."
        },
        "DEV-MODEL": {
          "status": "applicable",
          "reason": "模型假设、独立依据与真实补充",
          "fact": "Polaris 持久状态核心; 此次为完整维护义务登记, 仅本地样例采集不替代整条规则."
        },
        "DEV-STOP": {
          "status": "applicable",
          "reason": "自有任务停止与残留核验",
          "fact": "Polaris 持久状态核心; 此次为完整维护义务登记, 仅本地样例采集不替代整条规则."
        },
        "DEV-IMPACT": {
          "status": "applicable",
          "reason": "影响闭包与证据失效",
          "fact": "Polaris 持久状态核心; 此次为完整维护义务登记, 仅本地样例采集不替代整条规则."
        },
        "DEV-MATRIX": {
          "status": "applicable",
          "reason": "适用能力与配置矩阵",
          "fact": "Polaris 持久状态核心; 此次为完整维护义务登记, 仅本地样例采集不替代整条规则."
        },
        "DEV-GATE": {
          "status": "applicable",
          "reason": "受控验收及负向自检",
          "fact": "Polaris 持久状态核心; 此次为完整维护义务登记, 仅本地样例采集不替代整条规则."
        },
        "DEV-FAILURE": {
          "status": "applicable",
          "reason": "失败处置与隔离恢复",
          "fact": "Polaris 持久状态核心; 此次为完整维护义务登记, 仅本地样例采集不替代整条规则."
        },
        "DEV-AUDIT": {
          "status": "applicable",
          "reason": "复杂度依据、反向分析与终点",
          "fact": "Polaris 持久状态核心; 此次为完整维护义务登记, 仅本地样例采集不替代整条规则."
        },
        "DEV-SUPPLY": {
          "status": "applicable",
          "reason": "依赖准入、锁定与交付身份",
          "fact": "Polaris 持久状态核心; 此次为完整维护义务登记, 仅本地样例采集不替代整条规则."
        },
        "DEV-COMPAT": {
          "status": "applicable",
          "reason": "接口、版本、迁移与回退",
          "fact": "Polaris 持久状态核心; 此次为完整维护义务登记, 仅本地样例采集不替代整条规则."
        },
        "DEV-RELEASE": {
          "status": "applicable",
          "reason": "实际候选门槛与发布权限",
          "fact": "Polaris 持久状态核心; 此次为完整维护义务登记, 仅本地样例采集不替代整条规则."
        },
        "DEV-OPERATE": {
          "status": "applicable",
          "reason": "稳态运行、维护与恢复",
          "fact": "Polaris 持久状态核心; 此次为完整维护义务登记, 仅本地样例采集不替代整条规则."
        },
        "DEV-EVIDENCE": {
          "status": "applicable",
          "reason": "原生事实、关联与内容核验",
          "fact": "Polaris 持久状态核心; 此次为完整维护义务登记, 仅本地样例采集不替代整条规则."
        },
        "DEV-CONFIG": {
          "status": "applicable",
          "reason": "有效配置、继承和环境",
          "fact": "Polaris 持久状态核心; 此次为完整维护义务登记, 仅本地样例采集不替代整条规则."
        },
        "DEV-ADOPTION": {
          "status": "applicable",
          "reason": "接入成熟度与规范演进",
          "fact": "Polaris 持久状态核心; 此次为完整维护义务登记, 仅本地样例采集不替代整条规则."
        }
      },
      "requirements": [
        {
          "rule": "DEV-CONTRACT",
          "contract": "STORAGE-ATOMIC",
          "scenario": "bounded-example",
          "checks": [
            "storage-examples"
          ]
        },
        {
          "rule": "DEV-RETRY",
          "contract": "STORAGE-RETRY",
          "scenario": "bounded-example",
          "checks": [
            "storage-examples"
          ]
        },
        {
          "rule": "DEV-FAULT",
          "contract": "STORAGE-ROLLBACK",
          "scenario": "bounded-example",
          "checks": [
            "storage-examples"
          ]
        },
        {
          "rule": "DEV-COMPAT",
          "contract": "STORAGE-HISTORY",
          "scenario": "bounded-example",
          "checks": [
            "storage-examples"
          ]
        },
        {
          "rule": "DEV-SCOPE",
          "contract": "STORAGE-ASSURANCE",
          "scenario": "full-rule",
          "checks": [
            "gap-scope"
          ]
        },
        {
          "rule": "DEV-TRACE",
          "contract": "STORAGE-ASSURANCE",
          "scenario": "full-rule",
          "checks": [
            "gap-trace"
          ]
        },
        {
          "rule": "DEV-CORE",
          "contract": "STORAGE-ASSURANCE",
          "scenario": "full-rule",
          "checks": [
            "gap-core"
          ]
        },
        {
          "rule": "DEV-ASYNC",
          "contract": "STORAGE-ASSURANCE",
          "scenario": "full-rule",
          "checks": [
            "gap-async"
          ]
        },
        {
          "rule": "DEV-TIME",
          "contract": "STORAGE-ASSURANCE",
          "scenario": "full-rule",
          "checks": [
            "gap-time"
          ]
        },
        {
          "rule": "DEV-CONTRACT",
          "contract": "STORAGE-ASSURANCE",
          "scenario": "full-rule",
          "checks": [
            "gap-contract"
          ]
        },
        {
          "rule": "DEV-SECURITY",
          "contract": "STORAGE-ASSURANCE",
          "scenario": "full-rule",
          "checks": [
            "gap-security"
          ]
        },
        {
          "rule": "DEV-CAPACITY",
          "contract": "STORAGE-ASSURANCE",
          "scenario": "full-rule",
          "checks": [
            "gap-capacity"
          ]
        },
        {
          "rule": "DEV-RETRY",
          "contract": "STORAGE-ASSURANCE",
          "scenario": "full-rule",
          "checks": [
            "gap-retry"
          ]
        },
        {
          "rule": "DEV-ORACLE",
          "contract": "STORAGE-ASSURANCE",
          "scenario": "full-rule",
          "checks": [
            "gap-oracle"
          ]
        },
        {
          "rule": "DEV-REDGREEN",
          "contract": "STORAGE-ASSURANCE",
          "scenario": "full-rule",
          "checks": [
            "gap-redgreen"
          ]
        },
        {
          "rule": "DEV-COVERAGE",
          "contract": "STORAGE-ASSURANCE",
          "scenario": "full-rule",
          "checks": [
            "gap-coverage"
          ]
        },
        {
          "rule": "DEV-REPLAY",
          "contract": "STORAGE-ASSURANCE",
          "scenario": "full-rule",
          "checks": [
            "gap-replay"
          ]
        },
        {
          "rule": "DEV-NUMERIC",
          "contract": "STORAGE-ASSURANCE",
          "scenario": "full-rule",
          "checks": [
            "gap-numeric"
          ]
        },
        {
          "rule": "DEV-FAULT",
          "contract": "STORAGE-ASSURANCE",
          "scenario": "full-rule",
          "checks": [
            "gap-fault"
          ]
        },
        {
          "rule": "DEV-MODEL",